{
  "schema_name": "petra.composition-plan",
  "schema_version": "1.0.0",
  "composition_plan_id": "composition_plan_01ARZ3NDEKTSV4RRFFQ69G5FCT",
  "revision": 1,
  "project_id": "project_01ARZ3NDEKTSV4RRFFQ69G5FAW",
  "composition_request_ref": {
    "composition_request_id": "composition_request_01ARZ3NDEKTSV4RRFFQ69G5FCS",
    "revision": 1,
    "content_hash": "sha256:839f4dea1cdcb721128365cfeaa99ef27edcdedc42a3a5984c0d3df56a1f9eba"
  },
  "evidence_packet_ref": {
    "evidence_packet_id": "evidence_packet_01ARZ3NDEKTSV4RRFFQ69G5FCG",
    "revision": 1,
    "content_hash": "sha256:e3d7679bec56bc80f2bbb9702398526ca69edac1c10836132efc365c36393d64"
  },
  "snapshot_ref": {
    "snapshot_id": "snapshot_01ARZ3NDEKTSV4RRFFQ69G5FCE",
    "snapshot_revision": 1,
    "event_position": 3,
    "content_hash": "sha256:bbbbbbbbbbbbbbbbbbbbbbbbbbbbbbbbbbbbbbbbbbbbbbbbbbbbbbbbbbbbbbbb"
  },
  "content": {
    "state": "ready",
    "sections": [
      {
        "section_id": "composition_section_01ARZ3NDEKTSV4RRFFQ69G5FC0",
        "position": 1,
        "heading": "Bounded finding",
        "purpose": "Report the selected study result and immediately preserve its scope limitation.",
        "moves": [
          {
            "move_id": "composition_move_01ARZ3NDEKTSV4RRFFQ69G5FC1",
            "position": 1,
            "planned_text": "Report that the selected study found a measurable improvement.",
            "semantic_origin": "source_report",
            "scientific_force": "direct_report",
            "evidence_refs": [
              {
                "context_selection_order": 1,
                "object_ref": {
                  "object_kind": "claim",
                  "object_id": "claim_01ARZ3NDEKTSV4RRFFQ69G5FBB",
                  "object_revision": 2,
                  "object_hash": "sha256:b316d82c938b5d76fc02e11dab16d71f1bcf2788ed66d8aacfac7c622330e7fa"
                },
                "relation": "direct_report"
              },
              {
                "context_selection_order": 2,
                "object_ref": {
                  "object_kind": "assertion",
                  "object_id": "assertion_01ARZ3NDEKTSV4RRFFQ69G5FBC",
                  "object_revision": 2,
                  "object_hash": "sha256:80dcb2c8926d758f99a45d9ca84b720e23f4583c45583586d28998b9bc013f8d"
                },
                "relation": "direct_report"
              }
            ],
            "citation_required": true,
            "limitations": [
              "Attribute the finding to the study rather than presenting it as independently established truth."
            ]
          },
          {
            "move_id": "composition_move_01ARZ3NDEKTSV4RRFFQ69G5FC2",
            "position": 2,
            "planned_text": "Limit the report to the study-defined evaluation task.",
            "semantic_origin": "source_report",
            "scientific_force": "qualification",
            "evidence_refs": [
              {
                "context_selection_order": 1,
                "object_ref": {
                  "object_kind": "claim",
                  "object_id": "claim_01ARZ3NDEKTSV4RRFFQ69G5FBB",
                  "object_revision": 2,
                  "object_hash": "sha256:b316d82c938b5d76fc02e11dab16d71f1bcf2788ed66d8aacfac7c622330e7fa"
                },
                "relation": "qualification"
              }
            ],
            "citation_required": true,
            "limitations": [
              "Do not generalize beyond the study-defined task and reported outcome."
            ]
          }
        ]
      }
    ],
    "unresolved_support": [],
    "coverage": {
      "state": "partial",
      "statement": "The plan accounts for every object selected for this bounded response; it does not claim literature completeness.",
      "limitations": [
        "No new literature search was performed for this composition task."
      ]
    },
    "authority_boundary": {
      "plan_is_scientific_authority": false,
      "prose_may_exceed_evidence": false
    }
  },
  "content_hash": "sha256:097274dcfb188ae63f62659a3a5135cd26c305a10372866f102f159acb53eac1",
  "compiled_by": {
    "actor_id": "actor_01ARZ3NDEKTSV4RRFFQ69G5FAV",
    "actor_kind": "service"
  },
  "compiled_at": "2026-08-29T15:00:02.000Z"
}
